{
  "$schema": "https://json-schema.org/draft/2020-12/schema",
  "$id": "https://heaotang.cn/contracts/foundation/development-checklist.v1.schema.json",
  "title": "Heaotang AI Development Flight Checklist v1",
  "type": "object",
  "additionalProperties": false,
  "required": ["contract_version", "checklist_id", "record_id", "task", "actor", "module_id", "status", "created_at", "completed_at", "items", "attestation"],
  "properties": {
    "contract_version": { "const": "development-checklist.v1" },
    "checklist_id": { "type": "string", "pattern": "^FC-[0-9]{8}-[A-Z0-9-]+$" },
    "record_id": { "type": "string", "pattern": "^IR-[0-9]{8}-[A-Z0-9-]+$" },
    "task": { "type": "string", "minLength": 1 },
    "actor": { "type": "string", "minLength": 1 },
    "module_id": { "type": ["string", "null"] },
    "status": { "enum": ["pending", "completed"] },
    "created_at": { "type": "string", "format": "date-time" },
    "completed_at": { "type": ["string", "null"], "format": "date-time" },
    "items": {
      "type": "array",
      "minItems": 1,
      "items": {
        "type": "object",
        "additionalProperties": false,
        "required": ["path", "sha256", "checked", "checked_at"],
        "properties": {
          "path": { "type": "string", "minLength": 1 },
          "sha256": { "type": "string", "pattern": "^[a-f0-9]{64}$" },
          "checked": { "type": "boolean" },
          "checked_at": { "type": ["string", "null"], "format": "date-time" }
        }
      }
    },
    "attestation": { "type": "string" }
  }
}
