{
  "contract_version": "development-checklist.v1",
  "checklist_id": "FC-20260710-AI-COLLABORATION",
  "record_id": "IR-20260710-AI-COLLABORATION",
  "task": "AI 协作治理、权限边界和事故防线",
  "actor": "Codex platform integration agent",
  "module_id": null,
  "status": "completed",
  "created_at": "2026-07-10T15:47:17.2933348Z",
  "completed_at": "2026-07-10T15:47:17.2933348Z",
  "items": [
    {
      "path": "contracts/foundation/governance-reading-list.v1.json",
      "sha256": "5f5357cc1cd49b6945118bd2c3fc56b240de38e6b931ed831984c657e00fb412",
      "checked": true,
      "checked_at": "2026-07-10T15:47:17.2933348Z"
    },
    {
      "path": "AGENTS.md",
      "sha256": "42c2b3ddbf76213891a2d9aa6a6732db71f49bb7657957c62ae9d8c134dde253",
      "checked": true,
      "checked_at": "2026-07-10T15:47:17.2933348Z"
    },
    {
      "path": "README.md",
      "sha256": "0f0afe0c1aca16571de2b72cb03571f4ec38292edb712b6a10ffc1c771cd00b6",
      "checked": true,
      "checked_at": "2026-07-10T15:47:17.2933348Z"
    },
    {
      "path": "CONSTRAINTS.md",
      "sha256": "71997677c29417b8eab69f7006044f742e3cec2ab29af9d4732d5b5dd12436fb",
      "checked": true,
      "checked_at": "2026-07-10T15:47:17.2933348Z"
    },
    {
      "path": "docs/project-management/service-plaza/project-status-one-page.md",
      "sha256": "f82e2622ae3f3d0270b56c2f05d993e76212513143fe59148515d73dc386164a",
      "checked": true,
      "checked_at": "2026-07-10T15:47:17.2933348Z"
    },
    {
      "path": "docs/project-management/dependency-driven-master-plan-v1.md",
      "sha256": "57d397bc72eaa0e5b65f72bc2dce950bf721862508986b6be9bfb157ec3842a0",
      "checked": true,
      "checked_at": "2026-07-10T15:47:17.2933348Z"
    },
    {
      "path": "contracts/foundation/foundation-capabilities.v1.json",
      "sha256": "3f7629813f665d83f5a2e8e709279e762c9b71d2d5787c8c877c804a357c2d40",
      "checked": true,
      "checked_at": "2026-07-10T15:47:17.2933348Z"
    },
    {
      "path": "contracts/foundation/engineering-standards.v1.json",
      "sha256": "a8ed703991664849a45d991a8207f33496eaf7f31fe51e4f1c0708d9c1a34232",
      "checked": true,
      "checked_at": "2026-07-10T15:47:17.2933348Z"
    },
    {
      "path": "contracts/foundation/recurring-issues.v1.json",
      "sha256": "ff89d27b1fd9559a0d61303bf800a31f08a8fdd109b5945026481178b0f86a7d",
      "checked": true,
      "checked_at": "2026-07-10T15:47:17.2933348Z"
    },
    {
      "path": "contracts/foundation/agent-collaboration.v1.json",
      "sha256": "51039cf4379486b8e06850d77542ad1e00dd9ca797ed7c640c86237825e888f5",
      "checked": true,
      "checked_at": "2026-07-10T15:47:17.2933348Z"
    },
    {
      "path": "docs/project-management/ai-coding-incident-lessons-2026-07-10.md",
      "sha256": "f15ed305fb096970a5e4580cc3dac41da5082156f80e64759fa9b28529376efd",
      "checked": true,
      "checked_at": "2026-07-10T15:47:17.2933348Z"
    },
    {
      "path": "docs/project-management/foundation-dependency-standard-v1.md",
      "sha256": "380cfac43ded93775b49cb95884f2b4f32b62c386698458d2ccf519694abd65b",
      "checked": true,
      "checked_at": "2026-07-10T15:47:17.2933348Z"
    },
    {
      "path": "docs/project-management/module-internal-dependency-standard-v1.md",
      "sha256": "2daffbc1c66da051bfe862358c0d8b995cef5a57ca12ef960548b249397e1801",
      "checked": true,
      "checked_at": "2026-07-10T15:47:17.2933348Z"
    },
    {
      "path": "docs/decisions/0007-stable-foundation-variable-business.md",
      "sha256": "207667809e2b740ba9d409bcbb16807faf0c5fc8c543aefe95fb7444faa5c42b",
      "checked": true,
      "checked_at": "2026-07-10T15:47:17.2933348Z"
    },
    {
      "path": "docs/decisions/0008-versioned-business-variables.md",
      "sha256": "0a881479c7d96184098363511d0851181bcad63d1c29443531fc227aa1fe24a8",
      "checked": true,
      "checked_at": "2026-07-10T15:47:17.2933348Z"
    },
    {
      "path": "docs/decisions/0009-approved-toolchain-per-layer.md",
      "sha256": "89fa3e84a6b63d03554edfbeba3054a2328def81611db42663ffb9f0bb88b4ff",
      "checked": true,
      "checked_at": "2026-07-10T15:47:17.2933348Z"
    },
    {
      "path": "docs/decisions/0010-ai-implementation-records-required.md",
      "sha256": "0c78d9add0caee675d8270f7d509991dc2c9cd406f79a43eb71ee2c593e75965",
      "checked": true,
      "checked_at": "2026-07-10T15:47:17.2933348Z"
    },
    {
      "path": "docs/decisions/0011-two-person-config-approval.md",
      "sha256": "2736e5c8584bd69f39bcfeb98dcdbb6c6a69b489f079487136502aff1e3272c1",
      "checked": true,
      "checked_at": "2026-07-10T15:47:17.2933348Z"
    },
    {
      "path": "docs/decisions/0012-two-strike-root-cause-rule.md",
      "sha256": "4207186ddd332684a8b8bbf7276b2fdca333898a6fbce1643e2d5e9b5f3dd4da",
      "checked": true,
      "checked_at": "2026-07-10T15:47:17.2933348Z"
    },
    {
      "path": "docs/decisions/0013-mandatory-ai-development-entrypoint.md",
      "sha256": "b25ef41ab97b9fa513d7733ba3aaf8622c84380b8c1b1fce12bd1c47917d01e2",
      "checked": true,
      "checked_at": "2026-07-10T15:47:17.2933348Z"
    },
    {
      "path": "docs/decisions/0014-ai-development-flight-checklist.md",
      "sha256": "30293518f9f2c2f2545e697b1fefb76da6dd41e18a66872487bb271251d0d53c",
      "checked": true,
      "checked_at": "2026-07-10T15:47:17.2933348Z"
    },
    {
      "path": "docs/decisions/0015-isolated-agent-work-and-controlled-integration.md",
      "sha256": "00e4d9aedea1c6a0ae1098dfc796acba6d29f9341a44a2a76e458671f0e0efc5",
      "checked": true,
      "checked_at": "2026-07-10T15:47:17.2933348Z"
    },
    {
      "path": "docs/decisions/0016-ai-agent-authority-and-untrusted-context.md",
      "sha256": "8cc790901187e5d810b3a4fec2b0d1dacba16eaf273628ced752e1ee74fada01",
      "checked": true,
      "checked_at": "2026-07-10T15:47:17.2933348Z"
    }
  ],
  "attestation": "I read and applied every checked governance input to this implementation."
}
