{
    "contract_version":  "development-checklist.v1",
    "checklist_id":  "FC-20260711-CLUB-ALLIANCE-F0-H0-M0",
    "record_id":  "IR-20260711-CLUB-ALLIANCE-F0-H0-M0",
    "task":  "俱乐部联盟 CA-F0-M0 与 CA-H0 顶层标准",
    "actor":  "Club Alliance module agent",
    "module_id":  "club-alliance",
    "status":  "pending",
    "created_at":  "2026-07-10T22:52:29.7467092Z",
    "completed_at":  null,
    "items":  [
                  {
                      "path":  "contracts/foundation/governance-reading-list.v1.json",
                      "sha256":  "a5db9ef44414b457d8bec993538b1023800ed36bca7cd70c07ba64025fe243ac",
                      "checked":  true,
                      "checked_at":  "2026-07-10T22:53:29.8511825Z"
                  },
                  {
                      "path":  "AGENTS.md",
                      "sha256":  "242fb10e0e85b9336e774c30e512275a3d139b4c7b71a74583884753417e9881",
                      "checked":  true,
                      "checked_at":  "2026-07-10T22:53:30.1297786Z"
                  },
                  {
                      "path":  "README.md",
                      "sha256":  "f199b00864ff616b99ce6c635ed62286b71b5a02fb8d7bb3f9f6cbb46fdde31a",
                      "checked":  true,
                      "checked_at":  "2026-07-10T22:53:30.4124377Z"
                  },
                  {
                      "path":  "CONSTRAINTS.md",
                      "sha256":  "2fd31b8c64d9a157de7cc883cf6c842c83a8a806ab8a7b37692bb1fc2a084225",
                      "checked":  true,
                      "checked_at":  "2026-07-10T22:53:30.6997000Z"
                  },
                  {
                      "path":  "docs/project-management/service-plaza/project-status-one-page.md",
                      "sha256":  "44de19e433fb9c37d89a92b11265891c4f8f1cc3f542a93de6c346190d9b04b2",
                      "checked":  true,
                      "checked_at":  "2026-07-10T22:53:54.1176580Z"
                  },
                  {
                      "path":  "docs/project-management/dependency-driven-master-plan-v1.md",
                      "sha256":  "57d397bc72eaa0e5b65f72bc2dce950bf721862508986b6be9bfb157ec3842a0",
                      "checked":  true,
                      "checked_at":  "2026-07-10T22:53:54.3855060Z"
                  },
                  {
                      "path":  "contracts/foundation/foundation-capabilities.v1.json",
                      "sha256":  "1a17bdf3417465706b9d8994afa312289bda99df30102b78d535209af34c67bd",
                      "checked":  true,
                      "checked_at":  "2026-07-10T22:54:13.8002111Z"
                  },
                  {
                      "path":  "contracts/foundation/engineering-standards.v1.json",
                      "sha256":  "a8ed703991664849a45d991a8207f33496eaf7f31fe51e4f1c0708d9c1a34232",
                      "checked":  true,
                      "checked_at":  "2026-07-10T22:54:14.1098659Z"
                  },
                  {
                      "path":  "contracts/foundation/recurring-issues.v1.json",
                      "sha256":  "97d4d322ee6ba1284ed474adaed939cb773198bac71999304d95a38e9a287433",
                      "checked":  true,
                      "checked_at":  "2026-07-10T22:54:29.9561918Z"
                  },
                  {
                      "path":  "contracts/foundation/agent-collaboration.v1.json",
                      "sha256":  "a477c00749c1e5f6dfd1120ae1cbeae47509ee41da55cec9eda7ea7e2076be57",
                      "checked":  true,
                      "checked_at":  "2026-07-10T22:55:05.3918870Z"
                  },
                  {
                      "path":  "docs/project-management/ai-coding-incident-lessons-2026-07-10.md",
                      "sha256":  "f15ed305fb096970a5e4580cc3dac41da5082156f80e64759fa9b28529376efd",
                      "checked":  true,
                      "checked_at":  "2026-07-10T22:54:30.2237278Z"
                  },
                  {
                      "path":  "docs/project-management/recursive-project-governance-v1.md",
                      "sha256":  "48913b35710b97db895e417c334084db8ce31ee4a4ec1c3d9e6f10ddeeb9402c",
                      "checked":  true,
                      "checked_at":  "2026-07-10T22:55:30.7900993Z"
                  },
                  {
                      "path":  "docs/project-management/foundation-dependency-standard-v1.md",
                      "sha256":  "380cfac43ded93775b49cb95884f2b4f32b62c386698458d2ccf519694abd65b",
                      "checked":  true,
                      "checked_at":  "2026-07-10T22:55:31.0778093Z"
                  },
                  {
                      "path":  "docs/project-management/module-internal-dependency-standard-v1.md",
                      "sha256":  "2daffbc1c66da051bfe862358c0d8b995cef5a57ca12ef960548b249397e1801",
                      "checked":  true,
                      "checked_at":  "2026-07-10T22:55:31.3549148Z"
                  },
                  {
                      "path":  "docs/decisions/0007-stable-foundation-variable-business.md",
                      "sha256":  "207667809e2b740ba9d409bcbb16807faf0c5fc8c543aefe95fb7444faa5c42b",
                      "checked":  false,
                      "checked_at":  null
                  },
                  {
                      "path":  "docs/decisions/0008-versioned-business-variables.md",
                      "sha256":  "0a881479c7d96184098363511d0851181bcad63d1c29443531fc227aa1fe24a8",
                      "checked":  false,
                      "checked_at":  null
                  },
                  {
                      "path":  "docs/decisions/0009-approved-toolchain-per-layer.md",
                      "sha256":  "89fa3e84a6b63d03554edfbeba3054a2328def81611db42663ffb9f0bb88b4ff",
                      "checked":  false,
                      "checked_at":  null
                  },
                  {
                      "path":  "docs/decisions/0010-ai-implementation-records-required.md",
                      "sha256":  "0c78d9add0caee675d8270f7d509991dc2c9cd406f79a43eb71ee2c593e75965",
                      "checked":  false,
                      "checked_at":  null
                  },
                  {
                      "path":  "docs/decisions/0011-two-person-config-approval.md",
                      "sha256":  "2736e5c8584bd69f39bcfeb98dcdbb6c6a69b489f079487136502aff1e3272c1",
                      "checked":  false,
                      "checked_at":  null
                  },
                  {
                      "path":  "docs/decisions/0012-two-strike-root-cause-rule.md",
                      "sha256":  "4207186ddd332684a8b8bbf7276b2fdca333898a6fbce1643e2d5e9b5f3dd4da",
                      "checked":  false,
                      "checked_at":  null
                  },
                  {
                      "path":  "docs/decisions/0013-mandatory-ai-development-entrypoint.md",
                      "sha256":  "b25ef41ab97b9fa513d7733ba3aaf8622c84380b8c1b1fce12bd1c47917d01e2",
                      "checked":  false,
                      "checked_at":  null
                  },
                  {
                      "path":  "docs/decisions/0014-ai-development-flight-checklist.md",
                      "sha256":  "30293518f9f2c2f2545e697b1fefb76da6dd41e18a66872487bb271251d0d53c",
                      "checked":  false,
                      "checked_at":  null
                  },
                  {
                      "path":  "docs/decisions/0015-isolated-agent-work-and-controlled-integration.md",
                      "sha256":  "00e4d9aedea1c6a0ae1098dfc796acba6d29f9341a44a2a76e458671f0e0efc5",
                      "checked":  false,
                      "checked_at":  null
                  },
                  {
                      "path":  "docs/decisions/0016-ai-agent-authority-and-untrusted-context.md",
                      "sha256":  "8cc790901187e5d810b3a4fec2b0d1dacba16eaf273628ced752e1ee74fada01",
                      "checked":  false,
                      "checked_at":  null
                  },
                  {
                      "path":  "docs/decisions/0017-readme-course-and-random-governance-exam.md",
                      "sha256":  "b27a7a7d0d1b6e7ad2d315ad359605dff71b00b7b92df734645bd414d115142a",
                      "checked":  false,
                      "checked_at":  null
                  },
                  {
                      "path":  "docs/decisions/0018-recursive-project-governance.md",
                      "sha256":  "fcbe62bdc09fb605a4e162cf2540e37234cbe4f16fd9e2dabb3547b2ac56067d",
                      "checked":  false,
                      "checked_at":  null
                  },
                  {
                      "path":  "contracts/foundation/module-dependencies/club-alliance.v1.json",
                      "sha256":  "49067073cc367fdc710c99b52f78192ca8f9e44201c231976493a8e4cdba6350",
                      "checked":  false,
                      "checked_at":  null
                  },
                  {
                      "path":  "contracts/modules/club-alliance/internal-dependencies.v1.json",
                      "sha256":  "4c31b563094168a6885d282b5403f42b24e48badb2eaf044ded485403b2438c7",
                      "checked":  false,
                      "checked_at":  null
                  }
              ],
    "attestation":  ""
}
